{
  "run_id": "cassandra-rtk-01__baseline__rep1__20260331-084800",
  "task_id": "cassandra-rtk-01",
  "family": "rtk",
  "variant": "baseline",
  "agent_id": "claude",
  "adapter_version": "0.1.0",
  "repo_commit": "0269fd5665751e8a6d8eab852e0f66c142b10ee6",
  "status": "passed",
  "validity": "valid",
  "reported_input_tokens": 14692,
  "reported_output_tokens": 3674,
  "reported_total_tokens": 18366,
  "elapsed_seconds": 53.3,
  "repair_iterations": 0,
  "validation_status": "passed",
  "files_changed": 0,
  "diff_size": 0,
  "artifact_dir": "benchmarks/results/official/cassandra-rtk-01__baseline__rep1__20260331-084800",
  "started_at": "2026-03-31T08:48:00+00:00",
  "finished_at": "2026-03-31T08:48:53.300000+00:00"
}