{
  "run_id": "cassandra-rtk-01__tool_variant__rep1__20260331-085400",
  "task_id": "cassandra-rtk-01",
  "family": "rtk",
  "variant": "tool_variant",
  "agent_id": "claude",
  "adapter_version": "0.1.0",
  "repo_commit": "0269fd5665751e8a6d8eab852e0f66c142b10ee6",
  "status": "passed",
  "validity": "valid",
  "reported_input_tokens": 5724,
  "reported_output_tokens": 1431,
  "reported_total_tokens": 7155,
  "elapsed_seconds": 22.2,
  "repair_iterations": 0,
  "validation_status": "passed",
  "files_changed": 0,
  "diff_size": 0,
  "artifact_dir": "benchmarks/results/official/cassandra-rtk-01__tool_variant__rep1__20260331-085400",
  "started_at": "2026-03-31T08:54:00+00:00",
  "finished_at": "2026-03-31T08:54:22.200000+00:00"
}