{
  "run_id": "cassandra-ripgrep-02__tool_variant__rep3__20260331-082200",
  "task_id": "cassandra-ripgrep-02",
  "family": "ripgrep",
  "variant": "tool_variant",
  "agent_id": "claude",
  "adapter_version": "0.1.0",
  "repo_commit": "0269fd5665751e8a6d8eab852e0f66c142b10ee6",
  "status": "passed",
  "validity": "valid",
  "reported_input_tokens": 6324,
  "reported_output_tokens": 1581,
  "reported_total_tokens": 7905,
  "elapsed_seconds": 24.1,
  "repair_iterations": 0,
  "validation_status": "passed",
  "files_changed": 0,
  "diff_size": 0,
  "artifact_dir": "benchmarks/results/official/cassandra-ripgrep-02__tool_variant__rep3__20260331-082200",
  "started_at": "2026-03-31T08:22:00+00:00",
  "finished_at": "2026-03-31T08:22:24.100000+00:00"
}