{
  "run_id": "cassandra-ast-grep-02__tool_variant__rep3__20260331-095800",
  "task_id": "cassandra-ast-grep-02",
  "family": "ast-grep",
  "variant": "tool_variant",
  "agent_id": "claude",
  "adapter_version": "0.1.0",
  "repo_commit": "0269fd5665751e8a6d8eab852e0f66c142b10ee6",
  "status": "passed",
  "validity": "valid",
  "reported_input_tokens": 6992,
  "reported_output_tokens": 1748,
  "reported_total_tokens": 8740,
  "elapsed_seconds": 26.1,
  "repair_iterations": 0,
  "validation_status": "passed",
  "files_changed": 0,
  "diff_size": 0,
  "artifact_dir": "benchmarks/results/official/cassandra-ast-grep-02__tool_variant__rep3__20260331-095800",
  "started_at": "2026-03-31T09:58:00+00:00",
  "finished_at": "2026-03-31T09:58:26.100000+00:00"
}