{
  "run_id": "cassandra-qmd-02__baseline__rep1__20260331-083600",
  "task_id": "cassandra-qmd-02",
  "family": "qmd",
  "variant": "baseline",
  "agent_id": "claude",
  "adapter_version": "0.1.0",
  "repo_commit": "0269fd5665751e8a6d8eab852e0f66c142b10ee6",
  "status": "passed",
  "validity": "valid",
  "reported_input_tokens": 16622,
  "reported_output_tokens": 4156,
  "reported_total_tokens": 20778,
  "elapsed_seconds": 60.7,
  "repair_iterations": 0,
  "validation_status": "passed",
  "files_changed": 0,
  "diff_size": 0,
  "artifact_dir": "benchmarks/results/official/cassandra-qmd-02__baseline__rep1__20260331-083600",
  "started_at": "2026-03-31T08:36:00+00:00",
  "finished_at": "2026-03-31T08:37:00.700000+00:00"
}