{
  "run_id": "cassandra-ast-grep-02__baseline__rep1__20260331-094800",
  "task_id": "cassandra-ast-grep-02",
  "family": "ast-grep",
  "variant": "baseline",
  "agent_id": "claude",
  "adapter_version": "0.1.0",
  "repo_commit": "0269fd5665751e8a6d8eab852e0f66c142b10ee6",
  "status": "passed",
  "validity": "valid",
  "reported_input_tokens": 12790,
  "reported_output_tokens": 3198,
  "reported_total_tokens": 15988,
  "elapsed_seconds": 52.3,
  "repair_iterations": 0,
  "validation_status": "passed",
  "files_changed": 0,
  "diff_size": 0,
  "artifact_dir": "benchmarks/results/official/cassandra-ast-grep-02__baseline__rep1__20260331-094800",
  "started_at": "2026-03-31T09:48:00+00:00",
  "finished_at": "2026-03-31T09:48:52.300000+00:00"
}