{
  "run_id": "cassandra-ripgrep-02__baseline__20260331-120000",
  "task_id": "cassandra-ripgrep-02",
  "family": "ripgrep",
  "variant": "baseline",
  "agent_id": "ClaudeAdapter",
  "adapter_version": "0.1.0",
  "repo_commit": "0269fd5665751e8a6d8eab852e0f66c142b10ee6",
  "status": "passed",
  "validity": "valid",
  "reported_input_tokens": 11500,
  "reported_output_tokens": 2900,
  "reported_total_tokens": 14400,
  "elapsed_seconds": 43.8,
  "repair_iterations": 0,
  "validation_status": "passed",
  "files_changed": 0,
  "diff_size": 0,
  "artifact_dir": "benchmarks/results/pilot/cassandra-ripgrep-02__baseline__20260331-120000",
  "started_at": "2026-03-31T12:00:00Z",
  "finished_at": "2026-03-31T12:00:43Z"
}