{
  "run_id": "cassandra-ripgrep-01__baseline__rep1__20260331-080000",
  "task_id": "cassandra-ripgrep-01",
  "family": "ripgrep",
  "variant": "baseline",
  "agent_id": "claude",
  "adapter_version": "0.1.0",
  "repo_commit": "0269fd5665751e8a6d8eab852e0f66c142b10ee6",
  "status": "passed",
  "validity": "valid",
  "reported_input_tokens": 12250,
  "reported_output_tokens": 3063,
  "reported_total_tokens": 15313,
  "elapsed_seconds": 43.8,
  "repair_iterations": 0,
  "validation_status": "passed",
  "files_changed": 0,
  "diff_size": 0,
  "artifact_dir": "benchmarks/results/official/cassandra-ripgrep-01__baseline__rep1__20260331-080000",
  "started_at": "2026-03-31T08:00:00+00:00",
  "finished_at": "2026-03-31T08:00:43.800000+00:00"
}