{
  "run_id": "cassandra-fastmod-01__tool_variant__rep2__20260331-092000",
  "task_id": "cassandra-fastmod-01",
  "family": "fastmod",
  "variant": "tool_variant",
  "agent_id": "claude",
  "adapter_version": "0.1.0",
  "repo_commit": "0269fd5665751e8a6d8eab852e0f66c142b10ee6",
  "status": "passed",
  "validity": "valid",
  "reported_input_tokens": 4036,
  "reported_output_tokens": 1010,
  "reported_total_tokens": 5046,
  "elapsed_seconds": 15.6,
  "repair_iterations": 0,
  "validation_status": "passed",
  "files_changed": 0,
  "diff_size": 0,
  "artifact_dir": "benchmarks/results/official/cassandra-fastmod-01__tool_variant__rep2__20260331-092000",
  "started_at": "2026-03-31T09:20:00+00:00",
  "finished_at": "2026-03-31T09:20:15.600000+00:00"
}