{
  "run_id": "cassandra-ripgrep-01__tool_variant__20260331-110000",
  "task_id": "cassandra-ripgrep-01",
  "family": "ripgrep",
  "variant": "tool_variant",
  "agent_id": "ClaudeAdapter",
  "adapter_version": "0.1.0",
  "repo_commit": "0269fd5665751e8a6d8eab852e0f66c142b10ee6",
  "status": "passed",
  "validity": "valid",
  "reported_input_tokens": 6400,
  "reported_output_tokens": 1600,
  "reported_total_tokens": 8000,
  "elapsed_seconds": 24.7,
  "repair_iterations": 0,
  "validation_status": "passed",
  "files_changed": 0,
  "diff_size": 0,
  "artifact_dir": "benchmarks/results/pilot/cassandra-ripgrep-01__tool_variant__20260331-110000",
  "started_at": "2026-03-31T11:00:00+00:00",
  "finished_at": "2026-03-31T11:00:24+00:00"
}
